{
  "task_id": "code-feature-tools-registry-duplicate-names",
  "title": "Reject duplicate tool registry names",
  "prompt": "Make the tools registry reject duplicate tool names deterministically with a clear error, and add unit tests for duplicate and unique registrations.",
  "category": "feature",
  "difficulty": "small",
  "surface_claim": "layers_targeted_preflight",
  "negative_control": false,
  "stale_context_trap": false,
  "time_budget_minutes": 25,
  "target_files": [
    "crates/layers-tools/src/registry.rs",
    "crates/layers-tools/src/lib.rs"
  ],
  "target_symbols": [
    "ToolRegistry",
    "register"
  ],
  "expected_relevant_files": [
    "crates/layers-tools/src/registry.rs",
    "crates/layers-tools/src/lib.rs"
  ],
  "expected_validation_commands": [
    "cargo test -q -p layers-tools -- --nocapture",
    "cargo check --workspace --all-targets"
  ],
  "success_rubric": {
    "full_success": "The requested repository change is implemented with focused regression coverage and all listed validation commands pass.",
    "partial_success": "The main behavior is implemented but validation is incomplete, coverage is weak, or minor follow-up is required.",
    "failure": "The requested behavior remains missing, untested, or introduces regressions.",
    "min_verification_quality": 4,
    "primary_endpoint": "verified_success"
  }
}
