{
  "task_id": "code-refactor-memory-index-fallback-tags",
  "title": "Standardize memory retrieval fallback tags",
  "prompt": "Refactor memory index retrieval fallback tags so UC unavailable, timeout, and low-result cases are reported consistently without changing successful retrieval output.",
  "category": "refactor",
  "difficulty": "medium",
  "surface_claim": "layers_targeted_preflight",
  "negative_control": false,
  "stale_context_trap": false,
  "time_budget_minutes": 45,
  "target_files": [
    "src/uc.rs",
    "src/memory_index/retrieval.rs",
    "src/memory_index/pipeline.rs"
  ],
  "target_symbols": [
    "retrieve_with_opts",
    "Retriever"
  ],
  "expected_relevant_files": [
    "src/uc.rs",
    "src/memory_index/retrieval.rs",
    "src/memory_index/pipeline.rs"
  ],
  "expected_validation_commands": [
    "cargo test -q uc::tests -- --nocapture",
    "cargo test -q memory_index -- --nocapture"
  ],
  "success_rubric": {
    "full_success": "The requested repository change is implemented with focused regression coverage and all listed validation commands pass.",
    "partial_success": "The main behavior is implemented but validation is incomplete, coverage is weak, or minor follow-up is required.",
    "failure": "The requested behavior remains missing, untested, or introduces regressions.",
    "min_verification_quality": 4,
    "primary_endpoint": "verified_success"
  }
}
