{
  "task_id": "code-bugfix-context-routing",
  "title": "Fix context routing regression",
  "prompt": "Diagnose and fix a regression in Layers context routing where code-heavy queries with explicit Rust targets should request or inject targeted code context instead of falling back to memory-only context. Use tests to prove the routing behavior and run the relevant Rust validation gates.",
  "category": "bugfix",
  "target_files": [
    "src/cmd/query.rs",
    "src/cmd/preflight.rs",
    "crates/layers-core/src/packet_quality.rs"
  ],
  "target_symbols": [
    "task_spec_for_query",
    "query_looks_code_heavy",
    "PacketQualityReport"
  ],
  "expected_relevant_files": [
    "src/cmd/query.rs",
    "src/cmd/preflight.rs",
    "crates/layers-core/src/task_spec.rs"
  ],
  "expected_validation_commands": [
    "cargo test -q cmd::query -- --nocapture",
    "cargo check --workspace --all-targets",
    "cargo clippy --workspace --all-targets -- -D warnings"
  ],
  "success_rubric": {
    "full_success": "The routing regression is fixed with focused tests, targeted code context is used or requested for code-heavy Rust tasks, and all listed Rust validation commands pass.",
    "partial_success": "The regression is understood and partially fixed, but validation is incomplete or the routing still needs manual review.",
    "failure": "The routing behavior remains wrong, untested, or introduces regressions.",
    "min_verification_quality": 4
  }
}
