{
  "task_id": "code-feature-config-secret-redaction-nested",
  "title": "Redact nested provider secrets in config output",
  "prompt": "Extend config masking so nested provider secret-like values are redacted consistently in displayed or serialized diagnostic output. Add tests proving short and long secrets are not echoed.",
  "category": "feature",
  "difficulty": "medium",
  "surface_claim": "layers_targeted_preflight",
  "negative_control": false,
  "stale_context_trap": false,
  "time_budget_minutes": 45,
  "target_files": [
    "src/config.rs",
    "crates/layers-core/src/config.rs"
  ],
  "target_symbols": [
    "mask_secrets",
    "mask_secret"
  ],
  "expected_relevant_files": [
    "src/config.rs",
    "crates/layers-core/src/config.rs"
  ],
  "expected_validation_commands": [
    "cargo test -q config::tests::mask -- --nocapture",
    "cargo check --workspace --all-targets"
  ],
  "success_rubric": {
    "full_success": "The requested repository change is implemented with focused regression coverage and all listed validation commands pass.",
    "partial_success": "The main behavior is implemented but validation is incomplete, coverage is weak, or minor follow-up is required.",
    "failure": "The requested behavior remains missing, untested, or introduces regressions.",
    "min_verification_quality": 4,
    "primary_endpoint": "verified_success"
  }
}
