{
  "task_id": "code-bugfix-proveit-artifact-paths",
  "title": "Prevent proveit artifact path traversal",
  "prompt": "Add path safety checks to proveit artifact storage so artifact names cannot escape the run directory through absolute paths, symlinks, or parent traversal. Add tests.",
  "category": "bugfix",
  "difficulty": "medium",
  "surface_claim": "layers_targeted_preflight",
  "negative_control": false,
  "stale_context_trap": false,
  "time_budget_minutes": 45,
  "target_files": [
    "src/proveit/artifact_store.rs",
    "src/proveit/runner.rs",
    "src/proveit/git.rs"
  ],
  "target_symbols": [
    "ArtifactStore",
    "write_artifact"
  ],
  "expected_relevant_files": [
    "src/proveit/artifact_store.rs",
    "src/proveit/runner.rs",
    "src/proveit/git.rs"
  ],
  "expected_validation_commands": [
    "cargo test -q prove_it_sprint -- --nocapture",
    "cargo check --workspace --all-targets"
  ],
  "success_rubric": {
    "full_success": "The requested repository change is implemented with focused regression coverage and all listed validation commands pass.",
    "partial_success": "The main behavior is implemented but validation is incomplete, coverage is weak, or minor follow-up is required.",
    "failure": "The requested behavior remains missing, untested, or introduces regressions.",
    "min_verification_quality": 4,
    "primary_endpoint": "verified_success"
  }
}
