{
  "task_id": "code-feature-daemon-heartbeat-stale-detection",
  "title": "Add stale daemon heartbeat detection",
  "prompt": "Implement stale heartbeat detection for the daemon lifecycle so health checks report stale but not dead processes correctly. Add tests for fresh, stale, and missing heartbeat files.",
  "category": "feature",
  "difficulty": "medium",
  "surface_claim": "layers_targeted_preflight",
  "negative_control": false,
  "stale_context_trap": false,
  "time_budget_minutes": 45,
  "target_files": [
    "crates/layers-daemon/src/heartbeat.rs",
    "crates/layers-daemon/src/lifecycle.rs"
  ],
  "target_symbols": [
    "Heartbeat",
    "Lifecycle"
  ],
  "expected_relevant_files": [
    "crates/layers-daemon/src/heartbeat.rs",
    "crates/layers-daemon/src/lifecycle.rs"
  ],
  "expected_validation_commands": [
    "cargo test -q -p layers-daemon -- --nocapture",
    "cargo check --workspace --all-targets"
  ],
  "success_rubric": {
    "full_success": "The requested repository change is implemented with focused regression coverage and all listed validation commands pass.",
    "partial_success": "The main behavior is implemented but validation is incomplete, coverage is weak, or minor follow-up is required.",
    "failure": "The requested behavior remains missing, untested, or introduces regressions.",
    "min_verification_quality": 4,
    "primary_endpoint": "verified_success"
  }
}
