{
  "task_id": "code-bugfix-router-historical-code-intent",
  "title": "Keep historical code mentions memory eligible",
  "prompt": "Fix routing so historical or prior-decision questions that mention code terms remain memory-eligible unless they clearly request edit/debug/action work. Add benchmark-style routing tests.",
  "category": "bugfix",
  "difficulty": "medium",
  "surface_claim": "layers_targeted_preflight",
  "negative_control": false,
  "stale_context_trap": false,
  "time_budget_minutes": 45,
  "target_files": [
    "src/router.rs",
    "src/cmd/query.rs"
  ],
  "target_symbols": [
    "route_query",
    "historical_query_routes_memory"
  ],
  "expected_relevant_files": [
    "src/router.rs",
    "src/cmd/query.rs"
  ],
  "expected_validation_commands": [
    "cargo test -q router::tests -- --nocapture",
    "cargo test -q cmd::query -- --nocapture"
  ],
  "success_rubric": {
    "full_success": "The requested repository change is implemented with focused regression coverage and all listed validation commands pass.",
    "partial_success": "The main behavior is implemented but validation is incomplete, coverage is weak, or minor follow-up is required.",
    "failure": "The requested behavior remains missing, untested, or introduces regressions.",
    "min_verification_quality": 4,
    "primary_endpoint": "verified_success"
  }
}
