{
  "task_id": "code-docs-architecture-context-spine",
  "title": "Document context spine architecture without runtime overclaim",
  "prompt": "Improve architecture documentation or CLI help to describe Layers as a local-first context compiler/context spine for coding agents, not a competing agent runtime. Keep claims evidence-gated.",
  "category": "other",
  "difficulty": "small",
  "surface_claim": "layers_targeted_preflight",
  "negative_control": false,
  "stale_context_trap": false,
  "time_budget_minutes": 25,
  "target_files": [
    "src/main.rs",
    "src/lib.rs",
    "benchmarks/workflows/README.md"
  ],
  "target_symbols": [
    "Cli",
    "north_star"
  ],
  "expected_relevant_files": [
    "src/main.rs",
    "src/lib.rs",
    "benchmarks/workflows/README.md"
  ],
  "expected_validation_commands": [
    "cargo test -q tests::cli_about_positions_layers_as_context_packet_compiler -- --nocapture",
    "cargo check --workspace --all-targets"
  ],
  "success_rubric": {
    "full_success": "The requested repository change is implemented with focused regression coverage and all listed validation commands pass.",
    "partial_success": "The main behavior is implemented but validation is incomplete, coverage is weak, or minor follow-up is required.",
    "failure": "The requested behavior remains missing, untested, or introduces regressions.",
    "min_verification_quality": 4,
    "primary_endpoint": "verified_success"
  }
}
