{
  "task_id": "code-feature-mcp-preflight-stable-registry",
  "title": "Keep MCP preflight in stable registry",
  "prompt": "Add a regression guard that stable MCP preflight_context remains exposed in the stable registry and routes packet generation through the compiler-backed path.",
  "category": "feature",
  "difficulty": "medium",
  "surface_claim": "layers_targeted_preflight",
  "negative_control": false,
  "stale_context_trap": false,
  "time_budget_minutes": 45,
  "target_files": [
    "crates/layers-mcp/src/stable.rs",
    "crates/layers-mcp/src/server.rs",
    "crates/layers-compiler/src/lib.rs"
  ],
  "target_symbols": [
    "preflight_context",
    "ContextCompiler"
  ],
  "expected_relevant_files": [
    "crates/layers-mcp/src/stable.rs",
    "crates/layers-mcp/src/server.rs",
    "crates/layers-compiler/src/lib.rs"
  ],
  "expected_validation_commands": [
    "cargo test -q -p layers-mcp -- --nocapture",
    "cargo check --workspace --all-targets"
  ],
  "success_rubric": {
    "full_success": "The requested repository change is implemented with focused regression coverage and all listed validation commands pass.",
    "partial_success": "The main behavior is implemented but validation is incomplete, coverage is weak, or minor follow-up is required.",
    "failure": "The requested behavior remains missing, untested, or introduces regressions.",
    "min_verification_quality": 4,
    "primary_endpoint": "verified_success"
  }
}
