{
  "task_id": "code-bugfix-workflow-benchmark-duplicate-pairing",
  "title": "Avoid duplicate replicate cross-product pairing",
  "prompt": "Fix workflow benchmark paired comparison logic if duplicate task replicates create cross-product bias. Aggregate per task and variant before computing paired deltas, with tests.",
  "category": "bugfix",
  "difficulty": "medium",
  "surface_claim": "layers_targeted_preflight",
  "negative_control": false,
  "stale_context_trap": false,
  "time_budget_minutes": 45,
  "target_files": [
    "src/cmd/workflow_benchmark.rs"
  ],
  "target_symbols": [
    "paired_comparisons",
    "aggregate_variants"
  ],
  "expected_relevant_files": [
    "src/cmd/workflow_benchmark.rs"
  ],
  "expected_validation_commands": [
    "cargo test -q workflow_benchmark -- --nocapture",
    "cargo check --workspace --all-targets"
  ],
  "success_rubric": {
    "full_success": "The requested repository change is implemented with focused regression coverage and all listed validation commands pass.",
    "partial_success": "The main behavior is implemented but validation is incomplete, coverage is weak, or minor follow-up is required.",
    "failure": "The requested behavior remains missing, untested, or introduces regressions.",
    "min_verification_quality": 4,
    "primary_endpoint": "verified_success"
  }
}
