{
  "task_id": "code-feature-packet-validate-warnings-json",
  "title": "Emit packet validation warnings in JSON",
  "prompt": "Add or fix JSON output for packet validation so warning codes are preserved without echoing packet body text or secret-like content. Prove the JSON contract with focused tests.",
  "category": "feature",
  "difficulty": "medium",
  "surface_claim": "layers_targeted_preflight",
  "negative_control": false,
  "stale_context_trap": false,
  "time_budget_minutes": 45,
  "target_files": [
    "src/cmd/packet.rs",
    "crates/layers-core/src/context_packet.rs"
  ],
  "target_symbols": [
    "validate_packet",
    "PacketValidationReport"
  ],
  "expected_relevant_files": [
    "src/cmd/packet.rs",
    "crates/layers-core/src/context_packet.rs"
  ],
  "expected_validation_commands": [
    "cargo test -q cmd::packet -- --nocapture",
    "cargo check --workspace --all-targets"
  ],
  "success_rubric": {
    "full_success": "The requested repository change is implemented with focused regression coverage and all listed validation commands pass.",
    "partial_success": "The main behavior is implemented but validation is incomplete, coverage is weak, or minor follow-up is required.",
    "failure": "The requested behavior remains missing, untested, or introduces regressions.",
    "min_verification_quality": 4,
    "primary_endpoint": "verified_success"
  }
}
