{
  "task_id": "code-bugfix-council-circuit-exit-gate",
  "title": "Fix council circuit breaker exit gate edge case",
  "prompt": "Diagnose and fix an edge case where the council circuit breaker exit gate could reopen too early or too late around threshold boundaries. Prove behavior with boundary tests.",
  "category": "bugfix",
  "difficulty": "medium",
  "surface_claim": "layers_targeted_preflight",
  "negative_control": false,
  "stale_context_trap": false,
  "time_budget_minutes": 45,
  "target_files": [
    "src/council/circuit_breaker.rs",
    "src/council/topology.rs"
  ],
  "target_symbols": [
    "CircuitBreaker",
    "exit_gate"
  ],
  "expected_relevant_files": [
    "src/council/circuit_breaker.rs",
    "src/council/topology.rs"
  ],
  "expected_validation_commands": [
    "cargo test -q council::circuit_breaker -- --nocapture",
    "cargo test -q council::topology -- --nocapture"
  ],
  "success_rubric": {
    "full_success": "The requested repository change is implemented with focused regression coverage and all listed validation commands pass.",
    "partial_success": "The main behavior is implemented but validation is incomplete, coverage is weak, or minor follow-up is required.",
    "failure": "The requested behavior remains missing, untested, or introduces regressions.",
    "min_verification_quality": 4,
    "primary_endpoint": "verified_success"
  }
}
