{
  "task_id": "code-bugfix-query-target-traversal",
  "title": "Reject unsafe query targets",
  "prompt": "Ensure explicit query targets containing absolute paths or parent traversal cannot be treated as grounded repository targets. Add regression tests for absolute and .. paths.",
  "category": "bugfix",
  "difficulty": "small",
  "surface_claim": "layers_targeted_preflight",
  "negative_control": false,
  "stale_context_trap": false,
  "time_budget_minutes": 25,
  "target_files": [
    "src/context_packet_compiler/query_plan.rs",
    "src/cmd/query.rs"
  ],
  "target_symbols": [
    "QueryPlan",
    "explicit_parent_traversal_target_is_rejected"
  ],
  "expected_relevant_files": [
    "src/context_packet_compiler/query_plan.rs",
    "src/cmd/query.rs"
  ],
  "expected_validation_commands": [
    "cargo test -q context_packet_compiler::query_plan -- --nocapture",
    "cargo test -q cmd::query -- --nocapture"
  ],
  "success_rubric": {
    "full_success": "The requested repository change is implemented with focused regression coverage and all listed validation commands pass.",
    "partial_success": "The main behavior is implemented but validation is incomplete, coverage is weak, or minor follow-up is required.",
    "failure": "The requested behavior remains missing, untested, or introduces regressions.",
    "min_verification_quality": 4,
    "primary_endpoint": "verified_success"
  }
}
