{
  "task_id": "code-refactor-context-compiler-packet-finalize",
  "title": "Centralize packet finalization in context compiler",
  "prompt": "Refactor packet finalization paths so packet id, created_at, provenance, and stable metadata are set through ContextCompiler rather than duplicated ad hoc call sites. Preserve existing query and preflight behavior.",
  "category": "refactor",
  "difficulty": "large",
  "surface_claim": "layers_targeted_preflight",
  "negative_control": false,
  "stale_context_trap": false,
  "time_budget_minutes": 75,
  "target_files": [
    "src/context_packet_compiler/mod.rs",
    "src/cmd/query.rs",
    "src/cmd/preflight.rs"
  ],
  "target_symbols": [
    "ContextCompiler",
    "compile_query_packet"
  ],
  "expected_relevant_files": [
    "src/context_packet_compiler/mod.rs",
    "src/cmd/query.rs",
    "src/cmd/preflight.rs"
  ],
  "expected_validation_commands": [
    "cargo test -q context_packet_compiler -- --nocapture",
    "cargo test -q cmd::query -- --nocapture",
    "cargo check --workspace --all-targets"
  ],
  "success_rubric": {
    "full_success": "The requested repository change is implemented with focused regression coverage and all listed validation commands pass.",
    "partial_success": "The main behavior is implemented but validation is incomplete, coverage is weak, or minor follow-up is required.",
    "failure": "The requested behavior remains missing, untested, or introduces regressions.",
    "min_verification_quality": 4,
    "primary_endpoint": "verified_success"
  }
}
